<?xml version="1.0" encoding="UTF-8"?>
<!DOCTYPE Bookstore SYSTEM "Bookstore.dtd">
<Bookstore>
    
    <book>
        <B_id>1</B_id>
        <B_Name>Object-Oriented Programming with C++</B_Name>
        <Author>E. Balagurusamy</Author>
        <Price>350</Price>
        <Publisher>McGrow Hill</Publisher>
    </book>
    
    <book>
        <B_id>2</B_id>
        <B_Name>Object-Oriented Programming with Java</B_Name>
        <Author>E. Balagurusamy</Author>
        <Price>550</Price>
        <Publisher>McGrow Hill</Publisher>
    </book>
    
    <book> 
        <B_id>3</B_id>
        <B_Name>Let Us C</B_Name>
        <Author>Yashwant Kanetkar</Author>
        <Price>200</Price>
        <Publisher>BPB</Publisher>
    </book>
    
    <book>
        <B_id>4</B_id>
        <B_Name>Algorithm Design Manual</B_Name>
        <Author>Steven S Skiena</Author>
        <Price>4500</Price>
        <Publisher>Springer</Publisher>
    </book>
    
    <book>
        <B_id>5</B_id>
        <B_Name>A Student's Introduction to Programming</B_Name>
        <Author>Daniel Cook</Author>
        <Price>80</Price>
        <Publisher>XYZ</Publisher>
    </book>
    
</Bookstore>

